start_id,start_label,relationship,end_id,end_label,weight,evidence
2,Person,CEO_OF,1,Company,0.9,"Adventure Works's CEO, Nathan Reeves, expressed optimism about the company's financial trajectory and technological advancements."
1,Company,PARTNER_OF,13,Company,0.9,"Adventure Works has expanded its partnership with Contoso Compute (CCMP) by procuring its AI processors and compute hardware, ensuring rapid commercial deployment and future growth opportunities."
1,Company,PARTNER_OF,32,Company,0.9,Adventure Works has strengthened its technology partnership with Contoso Compute Solutions (CCMP).
3,Person,HEAD_OF,1,Company,0.9,"Lucas Brennan, Adventure Works's Chief Revenue Officer, disclosed that early adopters include a leading global insurance firm, as well as clients in the supply chain and security sectors."
6,Person,HEAD_OF,1,Company,0.9,Chief Financial Officer Owen Whitfield emphasized Adventure Works's focus on streamlining cloud-related expenditures while prioritizing investments in AI.
13,Company,CEO_OF,44,Person,0.9,Contoso Compute CEO Daniel Reeves
13,Company,LOCATED_IN,49,Location,0.9,The hum of high-performance servers reverberated through data centers across the globe
44,Person,CEO_OF,53,Company,0.9,"Commenting on the robust quarterly performance, Contoso Compute's founder and CEO Daniel Reeves said, ""Our exponential growth reflects a paradigm shift across industries--from traditional legacy infrastructure toward specialized, AI-accelerated compute."""
55,Person,HEAD_OF,53,Company,0.9,"The optimism at Contoso Compute was echoed by the company's executive vice president and CFO, Patricia Warren, in her detailed analysis of Contoso Compute's ongoing financial strategy and market-leading infrastructure."
44,Person,CEO_OF,13,Company,0.9,CEO Daniel Reeves's personal wealth exemplifies the company's meteoric rise.
13,Company,COMPETITOR_OF,48,Company,0.9,"While Apex AI Labs, a leader in the Generative AI field, may have surpassed $1.5 billion in annual revenue, it remains far from profitability. In stark contrast, Contoso Compute's financial performance places it in an entirely different league."
13,Company,COMPETITOR_OF,67,Company,0.9,"Although 2023 saw significant hype surrounding platforms like Apex AI Labs's StudyBot AI and Meridian AI Research's Meridian 2.1, the real ""gold rush"" within Large Language Models (LLMs) seems to center on the infrastructure enabling these developments."
55,Person,HEAD_OF,13,Company,0.9,"Patricia Warren, Contoso Compute's Executive Vice President and Chief Financial Officer"
13,Company,PARTNER_OF,87,Company,0.9,"key players in the software industry, including Prism Digital Corp., are racing to integrate AI copilots"
13,Company,PARTNER_OF,88,Company,0.9,"key players in the software industry, including Datamatrix Analytics, are racing to integrate AI copilots"
13,Company,PARTNER_OF,89,Company,0.9,"key players in the software industry, including Cloudpeak Data, are racing to integrate AI copilots"
13,Company,PARTNER_OF,90,Company,0.9,"key players in the software industry, including ProcedureFlow Corp., are racing to integrate AI copilots"
13,Company,PARTNER_OF,45,Company,0.9,leading cloud service providers such as CWS will begin offering DataCore-X2-based instances
13,Company,PARTNER_OF,46,Company,0.9,leading cloud service providers such as Global Systems Cloud Platform will begin offering DataCore-X2-based instances
13,Company,PARTNER_OF,47,Company,0.9,leading cloud service providers such as Summit Cloud will begin offering DataCore-X2-based instances
13,Company,PARTNER_OF,81,Company,0.9,leading cloud service providers such as Atlantic Database Systems will begin offering DataCore-X2-based instances
13,Company,LOCATED_IN,95,Location,0.9,Contoso Compute debuted a new AI Solutions Studio platform during Global Software Systems's annual cloud developer conference
111,Person,CEO_OF,110,Company,0.9,"EduCare's CEO, Robert Haines, has pointed out the substantial increase in student interest in StudyBot AI since March."
110,Company,PARTNER_OF,13,Company,0.9,"To support this initiative, the company has partnered with Contoso Compute to acquire advanced AI processors and cloud infrastructure necessary for hosting its educational models."
110,Company,COMPETITOR_OF,113,Company,0.9,"This sentiment was echoed in the broader market, as shares of Legacy Learning Corp (LLCO), a UK-based competitor, saw a 13.5% drop, underscoring the disruptive potential of AI in the education sector."
179,Company,LOCATED_IN,195,Location,0.9,Northwind's primary revenue contributors
182,Person,CEO_OF,179,Company,0.9,CEO James Harrington stated in an earnings call
179,Company,COMPETITOR_OF,198,Company,0.9,competitors like Orion and Peak Semiconductor are vying for global market share.
179,Company,COMPETITOR_OF,199,Company,0.9,competitors like Orion and Peak Semiconductor are vying for global market share.
179,Company,LOCATED_IN,203,Location,0.9,"For the quarter, the Reno, Nevada-based company posted a wider-than-historical net loss"
218,Company,SUPPLIES_TO,213,Company,0.9,its need for Zava's integration chemicals and cleanroom consumables has significantly declined
218,Company,SUPPLIES_TO,216,Company,0.9,and secondary assembly firms such as Stellar Dynamics
1,Company,LOCATED_IN,22,Location,0.9,"Revenue for the quarter climbed 20.9% year-over-year to $887.25 million, with U.S. revenue outperforming at a 25% growth rate, reaching $569.53 million."
213,Company,SUPPLIES_TO,186,Company,0.9,"NanoFab Equipment, which provides critical equipment for semiconductor fabrication, is particularly vulnerable to these shifts in capital spending. As major clients like Northwind and ISF scale back their expansion plans and delay equipment purchases, primary equipment providers are witnessing a contraction in their procurement pipelines."
213,Company,SUPPLIES_TO,179,Company,0.9,"NanoFab Equipment, which provides critical equipment for semiconductor fabrication, is particularly vulnerable to these shifts in capital spending. As major clients like Northwind and ISF scale back their expansion plans and delay equipment purchases, primary equipment providers are witnessing a contraction in their procurement pipelines."
213,Company,SUPPLIES_TO,83,Company,0.9,"But for NanoFab, whose revenue closely tracks the spending decisions of chip fabrication giants like Island Semiconductor Fabrication and Alpha Chip Group, the timing and extent of the slowdown have unnerved investors."
218,Company,LOCATED_IN,177,Location,0.9,Financial District Center wasn't subtle in its reaction to this news.
1,Company,LOCATED_IN,203,Location,0.9,"RENO--Adventure Works Analytics Holdings (Primary Stock Exchange: AWKS) has announced its financial results for the first quarter ending April 5, 2023."
110,Company,LOCATED_IN,22,Location,0.9,"EduCare Corp. (EDUC), a prominent U.S.-based education services provider, is currently navigating turbulent waters as it grapples with the impact of AI advancements on its business model."
