id,date,trigger_type,security_id,news_text
1,2023-10-24,news,2,"Adventure Works Analytics Holdings reported its first-ever GAAP operating profit and announced "unprecedented demand" for its new Artificial Intelligence platform (AIP)."
3,2023-10-24,"Earnings Report",5,"Northwind (NWND) reports a 50% year-on-year revenue decline and a large net loss, citing persistent memory oversupply and weak end-market demand. Management has announced a significant reduction in factory capital spending and has decided to cut expansion plans and delay all major equipment purchases until market conditions improve."
6,2023-10-24,news,6,"Contoso Compute (CCMP) reports record Q3 revenue driven by surging demand for its AI compute hardware. The company highlights strong GPU shipments to hyperscalers and raises full-year guidance, citing accelerating adoption of generative AI workloads as the primary growth driver."
4,2023-11-20,news,3,"Zava Technologies (ZVTC) unusual trading volume detected following Q3 earnings miss and a sharp decline in orders from semiconductor equipment manufacturers."
5,2023-11-20,news,6,"Contoso Compute (CCMP) reports record Q3 revenue driven by surging demand for its AI compute hardware. The company highlights strong GPU shipments to hyperscalers and raises full-year guidance, citing accelerating adoption of generative AI workloads as the primary growth driver."
